,Date,Absolution
67,2023-04-30,"Let everyone of us, together with the Apostle Paul, who wrote these words by the Holy Spirit, truly acknowledge this Scripture in our hearts. And so I declare by His Word, that each of you, who believes in Jesus' name, is loosed from your sins on earth and in heaven.  And for Christ's sake, I proclaim unto you the forgiveness of all your sins."
68,2023-05-07,"Your heavenly father, in His great mercy, did not spare His own Son, but has delivered Him up for us all. He does not condemn you, but for Christ's sake forgives all your sins."
69,2023-05-14,"Anyone present who persists in the love of sin, and refuses to repent from his shame, though their conscience convict them, I declare to you, by God's command, that His wrath and judgment abides upon you, and that all your sins are retained in heaven, and that you can never be delivered from eternal damnation, unless and until you repent. But, to every one of you beloved brothers and sisters, who abhor your sins, and resolve daily to turn from them and to serve the Lord in true holiness and righteousness; and believing in Him for the forgiveness of your sins: I declare, according to God's command, that from heaven you are released from all your sins (as Christ has promised in His Gospel), through the perfect satisfaction of the most holy passion, death, and resurrection of our Lord Jesus Christ.  Beloved in the Lord, your sins are forgiven."
70,2023-05-21,"Our heavenly father, in His great mercy, did not spare His own Son, but has delivered Him up for us all.  He does not condemn you, but for Christ's sake forgives all your sins."
71,2023-05-28,"Our heavenly father, in His great mercy, first sent His own Son, and then sent His Spirit, so that we would no longer be slaves to sin and death, but sons of God and heirs together with Christ.  To this the scars of Christ remain as a memorial in Heaven, and the Spirit of Christ remains in us as a Helper and Living Memorial on earth.  So remember now, and rejoice in that the Father, for Christ's sake, has forgiven your sins."
72,2023-06-04,"To you who have confessed your sins and asked God's mercy in Jesus' name, for you The Spirit intercedes along with the Son in Whose image you are being remade and The Father declares that if He did not withhold His Own Son, He will not withhold Forgiveness of your sins nor any gracious gift. People of God for Christ's sake all your sins are forgiven."
73,2023-06-11,
74,2023-06-18,"To you who have confessed your sins to God and seek His forgiveness in the name of His Son, Jesus, the Father declares to You His love and for Jesus' sake, cleanses you from all unrighteousness and forgives your sins."
75,2023-06-25,"Christians, Your heavenly Father, in His great mercy, hears your prayers.  To you who have confessed your sins in Christ Jesus and who have repented from walking according to the flesh and rather walk according to the Spirit God declares that there is now no condemnation for you in Christ Jesus, and that for His sake your sins are forgiven."
76,2023-07-02,"To you, covenant people, whose homes are marked by the blood of the Lamb, and whose very bodies are marked by the water of baptism, God declares that in Christ - your sins are forgiven and that the righteous judgment which falls on the wicked will not fall on you."
77,2023-07-09,"To you who have confessed your sin to God, seeking His forgiveness, to you who have cried to the Lord out of the depths, who wait for the Lord more than watchmen for the morning, God declares His steadfast love and plenteous redemption. There is forgiveness with God, that He may be feared.  For Christ's sake, our merciful God forgives all our sin."
78,2023-07-16,"This saying is true and we should believe it: that Christ Jesus came into the world to rescue sinners. He himself bore our sins in his body on the cross, that we might be dead to sin and alive to all that is good. To You who repent and believe in Him,  I proclaim to you the forgiveness of your sins, in the name of the Father, and of the Son, and of the Holy Spirit."
79,2023-07-23,"Brothers and sisters, this wonderful glorious truth is clear: Christ Jesus came into the world to rescue sinners. He himself bore our sins in his body on the cross, that we might be dead to sin and alive to all that is good. To You who repent and believe in Him,  I proclaim to you the forgiveness of your sins, in the name of the Father, and of the Son, and of the Holy Spirit."
80,2023-07-30,"Christian people, your Lord Himself bore your sins in His own body on the tree, so that you being in Him - would die unto sins, and live unto righteousness  you are healed by His wounds, and for His sake, the Father forgives all your sins."
81,2023-08-06,"Our Heavenly Father, in His great mercy, has given His only Son up to death for us.  He is the just Judge of the living and the dead, but in Christ, His mercy and forgiveness are given.  To you who confess your sin to God apart from spiritual guile, not hiding your sin, but  acknowledging it to Him  God, Himself, by the blood of His Son, covers your sin, and does not impute your iniquity. Christian, your sins are forgiven for Jesus sake."
82,2023-08-13,"To you who wait patiently for the Lord, who make the Lord your trust, God inclines to you, hears your cry, sets your feet upon a Rock, and for Christ's sake, forgives all your sin."
83,2023-08-20,"Covenant people of God, the Lord has heard your cry; He has not turned away your prayer of confession, nor taken His mercy from You.  For the sake of Jesus Christ His Son, He forgives all your sin."
84,2023-08-27,"To all who confess your sin to God and seek His forgiveness, God declares that He does not deal with you according to your sin or reward you as your iniquities deserve, but has removed your transgressions as far from you as the east is from the west. Christian, for Christ's sake, all your sins are forgiven."
85,2023-09-03,"Herein is love, not that we loved God, but that He loved us and sent His Son to be the propitiation for our sins."
86,2023-09-03,"To all who confess your sin to God sincerely and seek His forgiveness, God declares His love for you, the love He made known by sending His Son, Who was the propitiation for our sins. Christian, for Christ's sake, all your sins are forgiven.  Therefore, lift up your hearts!"
87,2023-09-10,"To you, who have confessed your sins, believing in Jesus, the Father declares to you that they are forgiven, and that for His sake, though you were deeply stained in scarlet, by Christ's blood, you are as snowy white wool and for Christ's sake, your sin is forgiven!"
88,2023-09-17,"In this Scripture, God promises us, His people, that He has taken away our iniquities, laid them on Christ, and for His sake, forgives all our sins."
89,2023-09-24,To you who have sought the Lord's mercy by confessing your sins and turning from unrighteous thoughts to the way of His Son God assures you once more than He has heard your prayers and for Christ's sake forgives all your sins.
90,2023-10-01,"Your heavenly Father, in His great mercy, has given His only Son to die for us.  To all who confess their sin to God and seek His forgiveness, to those who rend their hearts and return to the Lord, He is gracious and merciful to you, slow to anger and of great kindness.  Beloved in the Lord, for Christ's sake - all your sins are forgiven!"
91,2023-10-08,"Our heavenly Father, in His great mercy, has given His only Son to die for us, and for His sake forgives all our sins.  To all who confess their sin to God and seek His forgiveness, He passes over your transgression and has compassion on you; He casts all your sins into the depths of the sea."
92,2023-10-15,"Your heavenly Father, in His great mercy, has given His only Son to die for our redemption.  To you who have confessed your sin to God from your hearts, who turn and return to the Lord, Once more, He assures you that He is gracious and merciful to you, slow to anger and of great kindness.  Beloved in the Lord, for Christ's sake, all your sins are forgiven!"
93,2023-10-22,"All who continue to love their sin and shame, and persist in them, even against the conviction of their own conscience, I must declare to you, by God's command, that His wrath and judgment abides upon you, and that your sins are retained in heaven, and you will not be delivered from eternal judgment, unless you repent. But, to every one of you beloved brothers and sisters, who hate your sins, and seek pardon through the merits of Jesus Christ alone, and who resolve each day to turn from your sins and to the Lord, to serve Him in true holiness and righteousness: I declare, according to God's command, that from heaven you are released from all your sins (as Christ has promised in His Gospel), through the perfect satisfaction of the most holy passion and death of our Lord Jesus Christ. And since we do not doubt that our prayers and worship are sanctified by the sufferings of Jesus Christ, and therefore acceptable and well-pleasing to God, I call upon you now, to Lif up your hearts!"
94,2023-10-29,"To you who confess your sin to God and seek His forgiveness through Jesus,  to you who have stopped your mouth from excuse-making and self justification, and have confessed that with all the world you stand guilty before God    God declares that you are righteous in His sight together with all who believe in Jesus.  Beloved in the Lord, for Christ's sake, all your sins are forgiven."
95,2023-11-05,"Anyone who turns in thirst to any other source or spring than Christ is doomed to fail and fall under the just judgment of God   apart from Jesus Christ, all other promises are broken cisterns and polluted wells. But to you who have acknowledged that your thirst can be quenched ONLY by the living water of the Holy Spirit whom Jesus gives, the water that flows mingled with blood from His very heart - you have confessed your sin to God and sought His forgiveness, your Father in Heaven has had mercy upon you, and for the sake of the sufferings, death, and resurrection of His dear Son forgives all your sins."
96,2023-11-12,"To you who have confessed your sin to God, seeking His forgiveness, to you who have cried to the Lord out of the depths, who wait for the Lord more than watchmen for the morning, God declares His steadfast love and plenteous redemption. There is forgiveness with God, that He may be feared.  For Christ's sake, our merciful God forgives all our sin."
97,2023-11-19,"To you, covenant people, whose homes are marked by the blood of the Lamb, and whose very bodies are marked by the water of baptism, God declares that in Christ - your sins are forgiven and that the righteous judgment which falls on the wicked will not fall on you."
